id,word,pronunciation,chinese_meaning,example_1_en,example_1_zh,example_2_en,example_2_zh,category,difficulty,review_count,last_review_date
64,receiver desense,/rɪˈsiːvər diːˈsens/ | https://youglish.com/pronounce/receiver%20desense/english,接收器去敏感化；接收器靈敏度下降,Receiver desense can occur when onboard noise enters the antenna path.,當機上雜訊進入天線路徑時，可能發生接收器靈敏度下降。,The RF test should monitor receiver desense and packet loss at the same time.,RF 測試應同時監測接收器 desense 與封包遺失。,RF / Antenna Operations,Advanced,0,
65,counterpoise,/ˈkaʊntərpɔɪz/ | https://youglish.com/pronounce/counterpoise/english,天線配重地；對應地平面,An antenna mounted on a composite surface may need a counterpoise.,安裝在複材表面的天線可能需要 counterpoise。,"Without a counterpoise, RF current may return through power or communication cables.",若沒有 counterpoise，RF 電流可能經由電源或通訊線回流。,RF / Antenna Operations,Advanced,0,
66,antenna port induced level,/ænˈtenə pɔːrt ɪnˈduːst ˈlevl/ | https://youglish.com/pronounce/antenna%20port%20induced%20level/english,天線埠感應位準,Antenna port induced level should be checked during RF compatibility testing.,RF 相容性測試時應檢查天線埠感應位準。,The receiver may be damaged if the antenna port induced level is too high.,若天線埠感應位準過高，接收器可能受損。,RF / Antenna Operations,Advanced,0,
67,RF transmit inhibit,/ˌɑːr ˈef trænzˈmɪt ɪnˈhɪbɪt/ | https://youglish.com/pronounce/RF%20transmit%20inhibit/english,RF 發射禁止；發射抑制,RF transmit inhibit may be required during sensitive ground operations.,敏感地面操作期間可能需要 RF 發射禁止。,The test procedure should verify the RF transmit inhibit function.,測試程序應驗證 RF 發射禁止功能。,RF / Antenna Operations,Advanced,0,
68,power level control,/ˈpaʊər ˈlevl kənˈtroʊl/ | https://youglish.com/pronounce/power%20level%20control/english,功率等級控制,Power level control can reduce RF risk during integration testing.,功率等級控制可降低整合測試期間的 RF 風險。,The RF module should support power level control if desense is observed.,若觀察到 desense，RF 模組應支援功率等級控制。,RF / Antenna Operations,Intermediate,0,
69,mission-critical,/ˈmɪʃn ˈkrɪtɪkl/ | https://youglish.com/pronounce/mission-critical/english,任務關鍵的,Flight control and navigation are mission-critical functions.,飛控與導航是任務關鍵功能。,Mission-critical data should be monitored during all EMC test scenarios.,所有 EMC 測試情境都應監測任務關鍵資料。,System Safety / Reliability,Intermediate,0,
70,safety-critical,/ˈseɪfti ˈkrɪtɪkl/ | https://youglish.com/pronounce/safety-critical/english,安全關鍵的,A safety-critical command must not be triggered by RF interference.,安全關鍵指令不得被 RF 干擾誤觸發。,Safety-critical functions require clear pass-fail criteria.,安全關鍵功能需要明確的通過/失敗判準。,System Safety / Reliability,Intermediate,0,
